S.N.,Product Code,Products
1,01011000,Horses
2,01012100,Pure-bred breeding Horses
3,01012900,Horses
4,01013000,Asses
5,01019000,"Asses, mules and hinnies"
6,01021000,Live bovine animals
7,01022100,Pure-bred breeding Cattle
8,01022900,Cattle
9,01023100,Pure-bred breeding Buffalo
10,01023900,Buffalo
11,01029000,Live bovine animals
12,01031000,Live swine
13,01039100,Live swine  weighing less than 50 kg
14,01039200,Live swine weighing 50 kg or more
15,01041000,Sheep
16,01042000,Goats
17,01051100,"Fowls of the species Gallus domesticus, weighing not more than 185 g"
18,01051200,"Turkeys, weighing not more than 185 g"
19,01051300,Ducks
20,01051900,Live poultry weighing not more than 185g
21,01059400,Fowls of the species Galus domesticus
22,01059900,Live poultry
23,01060000,Live animals
24,01061100,Primates
25,01061300,Camels and other camelids
26,01061400,Rabbits and hares
27,01061900,Mammals
28,01062000,Reptiles
29,01063100,Birds or prey
30,01063900,Birds
31,01064100,Bees
32,01069000,Live animals
33,02011000,"Meat of bovine animals, carcasses and half-carcasses, fresh or chilled"
34,02012000,"Meats of bovine animals, fresh or chilled, cuts with bone in"
35,02013000,"Meat of bovine animal, boneless"
36,02021000,"Meats of bovine animals, caracasses and half-caracasses, frozen"
37,02022000,"Meat of bovine amimals, frozen, other cuts with bone in"
38,02023000,"Meat of bovine animals, frozen, boneless"
39,02031100,"Carcasses and half-carcasses of swine, fresh or chilled"
40,02031200,"Fresh or chilled hams, shoulders and cuts thereof, with bone in"
41,02031900,Fresh or chilled meat of swine
42,02032100,Frozen meat of swine carcasses and half-carcasses
43,02032200,"Frozen Hams, shoulders and cuts thereof, with bone in"
44,02032900,Frozen meat of swine
45,02041000,"Carcasses and half-carcasses of lambs, fresh or chilled"
46,02042100,"Meat of sheep, fresh or chilled , carcasses and half-carcasses"
47,02042200,"Meat of sheep, fresh or chilled, cuts with bone in"
48,02042300,"Meat of sheep, fresh or chilled, boneless"
49,02043000,"Carcassess and half-carcassess of lamb, frozen"
50,02044100,"Meat of sheep caracasses and half-caracasses,  frozen"
51,02044200,"Meat of sheep, cuts with bone in, frozen"
52,02044300,"Meat of sheep caracasses and half-caracasses, boneless, frozen"
53,02045000,Meat of goats
54,02050000,"Meat of horses,asses, mules or hinnies, resh, chilled or frozen"
55,02061000,"Edible offal of bovine animals, fresh or chilled"
56,02062200,"Livers of bovine animals, frozen"
57,02062900,Edible offal of bovine animals
58,02063000,"Edible offal of swine, fresh or chilled"
59,02064100,"Edible livers of swine, frozen"
60,02064900,"Edible offal of swine, frozen"
61,02068000,Edible offal of  swine fresh or chilled
62,02069000,"Edible offal of bovine animal, frozen"
63,02071100,"Fowls of the species Gallus domesticus not cut in pieces, fresh or chilled"
64,02071200,"Meat, and edible offal not cut in pieces,frozen"
65,02071300,"Cuts and offal of fowls of the species Gallus domesticus, fresh or chilled"
66,02071400,"Cuts and offal, frozen, of fowls of the species Gallus domesticus"
67,02072400,"Meat of turkey, not cut in pieces, fresh or chilled"
68,02072500,"Meat of turkey Not cut in pieces, frozen"
69,02072700,"Cuts and offal of turkeys, frozen"
70,02073200,"Ducks, geese or guinea fowlsNot cut in pieces, fresh or chilled"
71,02073300,"Meats of ducks, geese or guinea fowls,not cut in pieces, frozen"
72,02073400,"Fatty livers, fresh or chilled"
73,02073600,"Ducks, geese or guinea fowls  frozen"
74,02074100,"Ducks Not cut in pieces, fresh or chilled"
75,02074200,"Ducks cut in pieces, frozen"
76,02074400,"Meat and Edible Offal of ducks, fresh or chilled"
77,02074500,"Ducks, fresh or chilled"
78,02075500,"geese, frozen"
79,02083000,Meat of primates
80,02085000,Meat of reptiles(snakes and turtles)
81,02089000,"Edible meat offal, fresh or chilled"
82,02090000,"Pig fat, free of lean meat, and poultry fat, not rendered or otherwise extracted, fresh, chilled, frozen, salted, in  brine, dried or smoked"
83,02091000,"Pig fat, free of lean meat"
84,02101100,"Hams, shoulders and cuts of swine with bone in"
85,02101200,Bellies (streaky) and cuts thereof
86,02101900,Meat of swine
87,02102000,Meat
88,02109200,"Meat and edible meat offal, salted, in brine, dried or smoked of whales, dolphins and porpoises (mammals of the order Cetacea); of manatees and dugongs (mammals of the order Sirenia); of seals, sea lions and walruses"
89,02109900,Edible flours and meals of meatand  meat offal :
90,03011000,Ornamental fish
91,03011100,"Ornamental fish, Freshwater"
92,03011900,Ornamental fish
93,03019100,"Trout (Salmo trutta, oncorhynchus  mykiss, oncorhynchus clarki, oncorhynchus aquabonita, ncorhynchus gilae, Oncorhynchus appache and Oncorhynchus chrysoqaster"
94,03019200,Eels (Anguilla spp.)
95,03019400,"Atlantic and Pacific bluefin tunas (Thunnus thynnus, Thunnus orientalis)"
96,03019900,Live fish
97,03021100,"Trout, Salmo trutta, oncorhynchus  mykiss, oncorhynchus clarki,  oncorhynchus aquabonita, ncorhynchus gilae, Oncorhynchus appache and Oncorhynchus chrysoqaster"
98,03021200,Pacific salmon
99,03021300,"Pacific salmon (Oncorhynchus nerka, Oncorhynchus gorbuscha, Oncorhynchus keta, Oncorhynchus tschawytscha, Oncorhynchus kisutch, Oncorhynchus masouand Oncorhynchus rhodurus)"
100,03021400,Atlantic salmon (Salmo salar) and Danube salmon (Hucho hucho)
101,03021900,"Salmonidae, excluding livers and roes"
102,03022200,Plaice (Pleuronectes platessa)
103,03022300,Sole
104,03022900,Flat fish
105,03023200,Yellowfin tunas
106,03023300,Skipjack or stripe-bellied bonito
107,03023900,Tunas
108,03025100,"Cod (Gadus morhua, Gadus ogac, Gadus macrocephalus)"
109,03025900,"Gadidae, Macrouridae,Melanonidae, Merlucciidae  , Moridae and Muraenolepididae, excluding livers and roes"
110,03026600,Eels (Anguilla spp.)
111,03026900,Other fish
112,03027000,"Fish livers and roes, fresh or chilled"
113,03027100,Tilapias (Oreochromis spp.)
114,03027200,"Catfish (Pangasius spp., Silurus spp., Clarias  spp., Ictalurus spp.)"
115,03027900,"Nile perch (Lates niloticus) and snakeheads (Channa spp.),"
116,03028900,"Fish, excluding livers and roes"
117,03029000,Livers and roes
118,03031100,Sockeye salmon (red salmon) (Oncorhynchus  nerka)
119,03031200,"Pacific salmon (Oncorhynchus gorbuscha, Oncorhynchus keta, Oncorhynchus ischawytscha, Oncorhynchus kisutch, Oncorhynchus masou and Oncorhynchus rhodurus"
120,03031300,Atlantic salmon (Salmo salar) and Danube salmon (Hucho hucho)
121,03031400,"Trout (Salmo trutta, Oncorhynchus mykiss, Oncorhynchus clarki, Oncorhynchus aguabonita, Oncorhynchus gilae, Oncorhynchus apache and Oncorhynchus chrysogaster)"
122,03031900,"Salmonidae, excluding livers and roes"
123,03032200,Atlantic Salmon
124,03032400,"Catfish (Pangasius spp., Silurus spp., Clarias spp., Ictalurus spp.)"
125,03032900,"Frozen fish, salmonidae"
126,03033900,"Flat fish (Pleuronectidae, Bothidae, Cynoglossidae, Soleidae, Scophthalmidae and Citharidae), excluding livers and roes"
127,03034900,Tunas (of the genus Thunnus)
128,03036100,Swordfish (Xiphias gladius)
129,03036200,Toothfish (Dissostichus spp.)
130,03036300,"Cod (Gadus morhua, Gadus ogac, Gadus macrocephalus"
131,03036900,"fish, excluding livers and roes"
132,03037900,"Fish meat, frozen"
133,03038000,Livers and roes
134,03038900,"Fish, frozen, excluding fish fillets Livers, roes, milt, fish fins, heads, tails,maws and  other edible fish offal"
135,03041000,Fresh or chilled fish fillets
136,03041100,"Fish fillets and other fish meat (whether or not minced), fresh, chilled or frozen fresh or chilled"
137,03041200,Toothfish (Dissostichus spp.)
138,03041900,Fish fillets and other fish meat (whether or not minced)
139,03042000,Frozen fillets
140,03042100,Swordfish (Xiphias gladius)
141,03042900,Frozen fillets
142,03043100,Tilapias (Oreochromis spp.)
143,03043200,"Catfish (Pangasius spp., Silurus spp., Clarias spp., Ictalurus spp.)"
144,03043900,"Flat fish (Pleuronectidae, Bothidae, Cynoglossidae, Soleidae, Scophthalmidae and Citharidae), excluding livers and roes"
145,03044100,Pacific salmon
146,03044300,"Flat fish (Pleuronectidae, Bothidae,Cynoglo sidae, Soleidae, Scophthalmidae andCi"
147,03044900,Fresh or chilled fillets of other fish
148,03045300,"Fish of the families Bregmacerotidae,Euclichthyidae, Gadidae, Macrouridae, Melanonidae, Merlucciidae,Moridae and Muraenolepididae"
149,03045900,"Fish fillets and other fish meat, fresh or chilled"
150,03046200,"Catfish (Pangasius spp., Silurus spp., Clarias spp., Ictalurus spp.)"
151,03046900,Frozen fillets of tilapias
152,03047500,Alaska Pollack (Theragra chalcogramma)
153,03047900,"Frozen fillets of fish of the families Bregmacerotidae, Euclichthyidae, Gadidae, Macrouridae, Melanonidae, Merlucciidae, Moridae and Muraenolepididae"
154,03048100,Pacific salmon
155,03048900,Frozen fillets of other fish
156,03049000,"Fish meat, whether not not minced,fresh chilled or frozen"
157,03049100,Swordfish (Xiphias gladius)
158,03049900,"Fish fillets and other fish meat (whether or not minced), fresh, chilled or frozen"
159,03051000,"Flours, meals and pellets of fish, fit for human consumption"
160,03052000,"Livers and roes of fish, fried, smoked, saled or in brine"
161,03053000,"Fish fillets, dried, salted or in brine, but not smoked"
162,03053900,"Fish fillets, dried, salted or in brine, but not smoked"
163,03054100,"Pacific salmon, atlantic salmon and danube salmon"
164,03054200,"Herrings ,Clupea harengus, Clupea pallasii"
165,03054900,"Smoked fish, including fillets"
166,03055100,Cod
167,03055900,"Dried fish, not smoked"
168,03056300,Anchovies
169,03056900,"Fish, salted but not dried or smoked and fish in brine"
170,03061100,"Rocklobster and other sea craw fish (Palinurus spp.,Panulirus spp., Jasus spp.)"
171,03061200,Lobsters
172,03061300,Shrimps and prawns
173,03061400,Crabs
174,03061600,"Cold-water shrimps and prawns (Pandalus spp., Crangon crangon)"
175,03061700,"Shrimps and prawns, frozen"
176,03061900,"Fresh crustaceans, including flours, meals and pellets of crustaceans, fit for human consumption"
177,03062100,Rock lobster and other sea craw fish
178,03062300,"Shrimps and prawns, not frozen"
179,03062400,Crabs
180,03062700,"Shrimps and prawn, not frozen"
181,03062900,"Crustaceans, whether in shell or not, live, fresh, chilled, frozen, dried, salted or in brine including flours, meals and pellets of crustaceans, fit for  human consumption"
182,03071000,Oysters
183,03071100,"Oysters: Live, fresh or chilled"
184,03071900,Oysters
185,03072100,"Scallops, including queen scallops, of the genera pecten Chlamys or Placopecten live, fresh   or   chilled"
186,03072900,"Scallops, including queen scallops, of the genera pecten Chlamys or Placopecten"
187,03073900,"Mussels (Mytilus spp., perna spp.)"
188,03074100,"Cuttle fish, live, fresh or chilled"
189,03074900,Cuttle fish
190,03075100,"Octopus live, fresh or chilled"
191,03075200,Frozen Octopus
192,03075900,Octopus
193,03076000,"Snails, other than sea snails"
194,03079100,"Live, fresh or chilled of pellets of aquatic invertebrates other than  crustaceans, fit for human consumption"
195,03079900,"Flours, meals and pellets of aquatic invertebrates other than  crustaceans, fit for human consumption"
196,03082900,Sea urchins
197,04011000,"Milk and cream of a fat content, by weight, not exceeding 1%"
198,04012000,"Milk and cream, not concentrated nor containing added  sugar or other sweetening matter of a fat content, by weight, exceeding 1% but not  exceeding 6%"
199,04013000,"Milk and cream, of a fat content, by weight, exceeding  6%"
200,04014000,"Milk and cream, not concentrated nor  containing added sugar or other sweetening  matter of a fat content, by weight, exceeding 6 % but  not exceeding 10 %"
201,04015000,"Milk and cream, of a fat content, by weight, exceeding 10 % not concentrated nor containing added sugar or other sweetening matter"
202,04021000,"Milk and cream in powder, granules or other solid form, of a fat content, by weight, not exceeding 1.5%"
203,04022100,Milk and cream in solid form not containing sugar or sweetening matter of a fat content by weight exceeding 1.5%
204,04022900,Milk and cream in powdered and granules of a fat content by weight exceeding 1.5% containing sugar or added sweetening matter
205,04024200,"Meat of Sheep, frozen,cuts with bone in"
206,04029100,Milk and cream in liquid form not containing sugar or sweetening matster of a fat content by weight exceeding 1.5%
207,04029900,Milk and cream in liquid form containing added sugar or sweetening matter of a fat content by weight exceeding 1.5%
208,04031000,Yogurt
209,04039000,"Buttermilk, curdled milk and cream"
210,04041000,Whey and modified whey
211,04049000,Product consisting of natural milk constituents whether or not containing added sugar or sweetening matter
212,04051000,Butter
213,04052000,Dairy spreads
214,04059000,Fats and oils derived from milk
215,04061000,"Fresh cheese including whey cheese, and curd"
216,04062000,Grated or powdered cheese
217,04063000,Processed cheese
218,04064000,Blue veined cheese
219,04069000,Cheese
220,04070000,Birds eggs
221,04071100,"Fertilised eggs for incubation, of fowls of the species Gallus domesticus"
222,04071900,Fertilised eggs for incubation
223,04072100,Fresh eggs of fowls of the species Gallus domesticus
224,04072900,Fresh eggs
225,04079000,"Birds eggs, in shell, fresh, preserved or cooked"
226,04081100,Egg yolks: dried
227,04081900,Egg yolks
228,04089100,Dried egg yolks
229,04089900,"Birds eggs, not in shell"
230,04090000,Natural Honey
231,04090010,Raw Natural Honey
232,04090090,Natural Honey
233,04100000,"Edible products of animal origin, not elsewhere specified or included"
234,05010000,Human hair
235,05021000,"Pigs, hogs or boars bristle"
236,05029000,Badger hair and other brush-making  hair
237,05040000,"Guts, bladders and stomachs of animals"
238,05051000,Feather of a kind used for stuffing: down
239,05059000,Skins and other parts of birds
240,05061000,Ossein and bones treated with acid
241,05069000,"Bones and horn-cores, unworked, defatted, simply prepared, treated with acid or degelatinised, powder and waste of these products"
242,05071000,"Ivory, ivory powder and waste"
243,05079000,"whalebone and  whalebone hair, horns, antlers, hooves, nails, claws and beaks, unworked or simply  prepared but not cut to shape,powder and  waste  of these products"
244,05080000,"Coral and similar materials, unworked or  simply prepared but not otherwise worked, shells of molluscs, crustaceans or echinoderms and cuttlebone, unworked or simply prepared but not cut to shape,  powder   and waste  thereof"
245,05090000,Natural sponges of animal origin
246,05100000,"Ambergris, castoreum, civet and musk; cantharides;  bile, whether or not dried; glands and other animal  products used in the preparation of pharmaceutical   products, fresh, chilled, frozen or otherwise   provisionally preserved"
247,05111000,Bovine semen
248,05119100,Products of fish or crustaceans
249,05119910,Eggs of silk worm
250,05119990,Animal products not elsewhere specified  or included: dead animals
251,06011000,"Bulbs, tubers, tuberous roots, corms, crowns and rhizomes, dormant"
252,06012000,"Bulb, tubers, tuberous roots, corms, crowns and rhimzomes, in growth or in flower, chicory plants and roots."
253,06021000,Unrooted cuttings and slips
254,06022000,"Edible fruits or nuts trees, shrubs and bushes, grafted or not"
255,06023000,"Rhododendrons and azaleas, grafted or not"
256,06024000,"Roses, grafted or not"
257,06029000,Live plants
258,06031000,"Cut flowers, fresh"
259,06031100,Roses
260,06031200,Carnations
261,06031300,Orchid
262,06031400,Chrysanthemums
263,06031500,Lilies (Lilium spp.)
264,06031900,Cut flowers and flower buds of a kind suitable for bouquets or for ornamental purposes
265,06039000,"Cut flowers, dried, dyed, bleached, impregnated"
266,06041000,Mosses and lichens(bhdrachha)
267,06042000,"Foliage, branches and other parts of plants,  without flowers or flower buds, and grasses,  mosses  and lichens, being goods of a kind  suitable for bouquets or ornamental purposes,  fresh, dried, dyed, bleached, impregnated or  otherwise prepared, fresh"
268,06049000,"Foliage, branches and other parts of plants,  without flowers or flower buds, and grasses, mosses and lichens, being goods of a kind suitable for bouquets or ornamental purposes, dried, dyed, bleached, impregnated or  otherwise prepared."
269,06049100,"Foliage, branches and other parts of  plants, fresh"
270,06049900,"Foliages, branches and others parts of plant"
271,07011000,Potatoes seed
272,07019000,"Potatoes, fresh or chilled"
273,07020000,"Tomatoes, fresh or chilled"
274,07031000,Onions and shallots
275,07032000,Garlic
276,07039000,Leeks and other alliaccous vegetables
277,07041000,Cauliflowers and headed broccoli
278,07042000,Brussels sprouts
279,07044900,Cabbages
280,07049000,"Cabbage, kohlrabi, kale and similar edible brassicas, fresh or chilled"
281,07051100,Cabbage lettuce (head lettuce)
282,07051900,Lettuce (Lactucasativa)
283,07052100,Witloof chicory (Cichorium intybus var. foliosum)
284,07052900,Lettuce (Lactuca sativa) and chicory
285,07061000,Carrots and turnips
286,07069000,Edible roots
287,07070000,"Cucumbers and gherkins, fresh or chilled"
288,07080000,Multiple-walled insuating unit of glass
289,07081000,Fresh peas
290,07082000,"Beans (Vigna spp., phaseolus spp.)"
291,07089000,"Leguminous vegetable, shelled or unshelled"
292,07091000,Globe artichokes
293,07092000,Asparagus
294,07093000,Aubergines (egg plants)
295,07094000,Celery other than celeriac
296,07095100,Fresh mushrooms
297,07095900,"Mushrooms and truffles, fresh or chilled"
298,07096000,Fruits of genus capsicum or of genus pimenta
299,07097000,"Spinach, New Zealand spinach and orache spinach"
300,07099000,"Vegetables, fresh or chilled"
301,07099100,Globe artichokes
302,07099200,Olives
303,07099300,"Pumpkins, squash and gourds (Cucurbita spp.)"
304,07099900,"Vegetables, fresh or chilled"
305,07101000,Potatoes
306,07102100,Peas (Pisum sativum)
307,07102200,"Beans (Vigna spp., phaseolus spp.)"
308,07102900,Leguminous vegetables
309,07103000,"Spinach, New Zealand spinach and orache spinach (garden spinach)"
310,07104000,Sweet corn
311,07108000,Vegetables
312,07109000,Fresh green vegetable
313,07111000,Onions
314,07112000,Olives
315,07114000,Cucumber
316,07115100,Mushrooms of the genus Agaricus
317,07115900,"Mushrooms and truffles, provisionally preserved"
318,07119000,Vegetables: mixtures of vegetables
319,07122000,"Onions, dried"
320,07123000,Dried mushrooms and truffles
321,07123100,Dried mushrooms truffles
322,07123200,Wood ears (Auricularia spp.)
323,07123300,Jelly fungi (Tremella spp.)
324,07123900,Dried truffles
325,07129000,Dried vegetables
326,07129011,"Dry Garlic, neither crushed nor ground"
327,07129012,"Dry Garlic, crushed or ground"
328,07129090,Dry Garilic
329,07131000,Dried peas
330,07132000,Chickpeas
331,07133100,"Bean of the species vigna mungo, Hepper or vigna radiata Wilczek"
332,07133200,Small red (Adzuki) beans (phaseolus or Vigna angularis)
333,07133300,"Kidney beans, including white pea beans  (Phaseolus vulgaris)"
334,07133400,Bambara beans (Vigna subterranea or Voandzeia subterranea)
335,07133500,Cow peas (Vigna unguiculata)
336,07133900,"Beans (Vigna spp., phaseolus spp.), shelled, whether or not skinned or split"
337,07134000,Lentils
338,07134010,"Red lentils, unskinned, unsplit"
339,07134090,Red lentils
340,07135000,Broad beans and horse beans
341,07136000,Pigeon peas (Cajanus cajan)
342,07139000,Dried leguminous vegetables
343,07141000,Manioc (Cassava)
344,07142000,Sweet Potatoes
345,07143000,Yams (Dioscorea spp.)
346,07144000,Taro (Colocasia spp)
347,07149000,"Arrowroot, salep, Jerusalem artichokes"
348,08011100,Desiccated coconut
349,08011200,"Coconuts, in the inner shell (endocarp)"
350,08011900,Cocunuts
351,08012100,Brazil nuts in shell
352,08012200,Shelled brazil nuts
353,08013100,Cashew nuts in shell
354,08013200,Cashew nuts shelled
355,08021100,"Almonds, in shell"
356,08021200,"Almonds, shelled"
357,08022100,"Hazelnuts or filberts, In shell"
358,08022200,Hazelnuts or filberts
359,08023100,Walnuts in shell
360,08023200,"Wallnut, shelled"
361,08024000,Chestnuts
362,08024100,"Chestnuts, in shell"
363,08024200,"Chestnuts, shelled"
364,08025000,Pistachios
365,08025100,"Pistachios, in shell"
366,08025200,"Pistachios, shelled"
367,08026000,Macadamia nuts
368,08026100,Macadamia nuts in shell
369,08028000,Areca nuts
370,08029000,Betelnuts
371,08030000,Bananas
372,08031000,Plantains
373,08039000,"Bananas, fresh or dried"
374,08041000,Dates
375,08042000,Figs
376,08042010,Fresh Figs
377,08042090,Figs
378,08043000,Pineapples
379,08044000,Avocados
380,08045000,Mangoes
381,08051000,Oranges
382,08052000,Mandarins (including tangerines and satsumas)
383,08054000,Grapefruit
384,08055000,"Lemons (Citrus limon, citrus limonum)   and limes (Citrus aurantifolia, Citrus latifolia )"
385,08059000,Citrus fruits
386,08061000,Fresh Grapes
387,08062000,"Grapes, dried"
388,08071100,Water melons
389,08071900,Melons
390,08072000,Papaws (papayas)
391,08081000,"Apples, fresh"
392,08082000,Pears and quinces
393,08083000,Pears
394,08084000,Quinces
395,08085100,Orange
396,08091000,Fresh Apricots
397,08092000,"Cherries, fresh"
398,08092100,Sour cherries (Prunus cerasus)
399,08092900,Cherries
400,08093000,"Peaches, including nectarines"
401,08094000,Plums and sloes
402,08101000,Strawberries
403,08102000,"Raspberries, blackberries, mulberries and loganberries"
404,08103000,"Black, white or red currants and gooseberries"
405,08104000,"Cranberries, bilberries and other fruits of the genus Vaccinium"
406,08105000,Kiwifruit
407,08106000,Durians
408,08107000,Persimmons
409,08109000,Fresh fruit
410,08111000,"Strawberries, uncooked or cooked by steaming or boiling in water, frozen, whether or not containing added sugar or other sweetening matter"
411,08112000,"Rasberries, blackbarries, mulberries, loganbarries, black, white or red currants and gooseberries"
412,08119000,"Fruit and nuts, uncooked or cooked by  steaming or boiling in water, frozen,"
413,08121000,"Cherries, provisionally preserved"
414,08129000,"Fruit and nuts, provisionally preserved but unsuitable in that state for immediate consumption."
415,08131000,Dried Apricots
416,08132000,Prunes
417,08133000,Dried apple
418,08134000,Dry fruits
419,08135000,Mixtures of nuts or dried fruits
420,08140000,"Peels of citrus fruit or melon, fresh, frozen"
421,09011100,"Coffee, neither roasted nor decaffeinated"
422,09011200,"Coffee, not roasted, decaffeinated"
423,09012100,"Coffee, roasted, not decaffeinated"
424,09012200,"Coffee, roasted and decaffeinated"
425,09013000,Coffee husk and skin
426,09019000,Coffee
427,09021000,Green tea not fermented in immediate packing of a content not exceeding 3kg.
428,09022000,Green tea not fermented
429,09023000,"Black tea (fermented) and partly fermented tea, in immediate packings of a content not exceeding 3kg."
430,09024000,Black tea fermented
431,09030000,Mate
432,09041100,"Pepper, neither crushed nor ground"
433,09041200,"Pepper, crushed or ground"
434,09042000,"Fruits of the genus capsicum or of the genus pimenta, dried or crushed or ground"
435,09042100,"Fruits of the genus Capsicum or of the genus Pimenta, Dried, neither,crushed or ground"
436,09042200,"Fruits of the genus Capsicum or of the genus Pimenta, Dried, crushed or ground"
437,09050000,Vanilla
438,09051000,"Vanilla, Neither crushed nor ground"
439,09052000,"Vanilla, crushed or ground"
440,09061000,"Cinnamom, neither crushed nor ground"
441,09061100,Cinnamon (Cunnamomum zeylanicum Blume)
442,09061900,Cinnamon
443,09062000,"Cinnamom, crushed or ground"
444,09070000,Cloves
445,09071000,"Cloves, neither crushed nor ground"
446,09072000,"Cloves, crushed or ground"
447,09081000,Nutmeg
448,09081100,"Nutmeg, neither crushed nor ground"
449,09081200,"Nutmeg, crushed or ground"
450,09082000,Mace
451,09082100,"Fruits of the genus Capsicum or of the genus Pimenta, dried, neither, crushed or ground"
452,09082200,"Fruits of the genus Capsicum or of the genus Pimenta, crushed or ground"
453,09083010,Cardamom
454,09083090,"Cardamom, Small, Sukumel"
455,09083110,"Big Cardamon (Alaichi), neither crushed nor ground"
456,09083120,Small Cardamon (Sukumel)
457,09083210,"Big Cardamon (Alaichi), crushed or ground"
458,09083220,Small Cardamon (Sukumel)
459,09091000,Anise seeds
460,09092000,Seeds of coriander
461,09092100,"Seeds of coriander, neither crushed nor ground"
462,09092200,"Seeds of coriander, crushed or ground"
463,09093000,Cumin seeds
464,09093100,"Seeds of cumin, neither crushed nor ground"
465,09093200,"Seeds of cumin, crushed or ground"
466,09094000,Seeds of caraway
467,09095000,"Seed of fennel, juniper"
468,09096100,"Seeds  of anise, badian, caraway or fennel; juniper berries, neither crushed nor ground"
469,09096200,"Seeds  of anise, badian, caraway or fennel; juniper berries, crushed or ground"
470,09101000,Ginger
471,09101010,"Ginger, raw"
472,09101090,Dry Ginger
473,09101110,"Ginger, fresh"
474,09101190,Ginger
475,09101200,"Ginger, crushed or ground"
476,09102000,Saffron
477,09103000,Turmeric
478,09103010,"Turmeric (curcuma), fresh"
479,09103020,"Turmeric (curcuma), dust or Powder"
480,09103090,Turmeric (curcuma)
481,09104000,Thime: bay leaves
482,09105000,Curry spices
483,09109100,Fenugreek
484,09109900,Spices
485,09109910,Fenugreek (Methi)
486,09109990,Spices
487,10011000,Durum wheat
488,10011100,"Durum wheat, seed"
489,10011900,Durum wheat
490,10019000,Wheat and meslin
491,10019100,"Wheat and meslin, seed"
492,10019900,Wheat and meslin
493,10020000,Rye
494,10021000,Rye seed
495,10029000,Rye
496,10030000,Barley
497,10031000,Barley seed
498,10039000,Barley
499,10040000,Oats
500,10041000,"Oats, seed"
501,10049000,Oats
502,10051000,Maize seeds
503,10059000,Maize corn
504,10061000,Rice in the husk
505,10062000,Husked (brown) rice
