S.N.,Product Code,Products
1974,37023100,"Photographic films in rolls,sensitised unexposed for colour photography"
1975,37023200,"Photographic film in rolls other, with silver halide emulsion"
1976,37023900,"Photographic films in roll,sesitised, unexposed without perforation, of a width not exceeding 105mm"
1977,37024100,Film for colour photogrphy of a width exceeding 610mm and of a length exceeding 200m
1978,37024200,"Photographic film in rolls of a width exceeding 610 mm and of a length exceeding 200 m, other than for colour photography"
1979,37024300,Film for colour photogrphy of a width exceeding 610mm and of a length not exceeding 200m
1980,37024400,Film sensitised unexposed without perforations of a width exceeding 105 mm but not exceeding 610 mm
1981,37025100,Photographic film in rolls of a width not exceeding 16 mm and of a length    not exceeding 14 m
1982,37025200,Film for colour photography of a width not exceeding 16mm and of a length exceeding 14m
1983,37025300,"Film for color photography of a width exceeding 16mm but not exceeding 35mm and of a length not exceeding 30m, for slides"
1984,37025400,Film for colour photography of a width exceeding 16mm but not exceeding 35mm and of a length not exceeding 30m
1985,37025500,Film for colour photography of a width exceeding 16mm but not exceeding 35mm and of a length exceeding 30m
1986,37025600,"Film for colour photography, of a width exceeding 35 mm."
1987,37029100,"Photographic films in rolls, sensitised , unexposed of a width not exceeding than 16mm and of a length not exceeding 14m"
1988,37029300,Photographic film in rolls of a width exceeding 16 mm but not exceeding 35 mm and of a length not exceeding 30 m
1989,37029400,"Photographic film in rolls, sensitised,unexposed of a width exceeding 16mm but not exceeding 35mm and length exceeding 30m"
1990,37029500,"Photographic films in rolls, sensitised, unexposed of a width exceeding 35 mm"
1991,37029600,"Photographic film in rolls, sensitised, unexposed, of any material other  than paper, paperboard or textiles; instant print film in rolls, sensitised, unexposed Of a width not exceeding 35 mm and of a length not exceeding 30 m"
1992,37029700,"Photographic film in rolls,of a width not exceeding 35 mm and of a length exceeding 30 m"
1993,37029800,"Photographic film in rolls, sensitised, unexposed, of any material other  than paper, paperboard or textiles; instant print film in rolls, sensitised, unexposed Of a width not exceeding 35 mm and of a length exceeding 35 m"
1994,37031000,"Photographic paper, paperboard sensitised, unexposed in rolls of a width exceeding 610mm"
1995,37032000,"Photographic paper for colour photography sensitised, unexposed"
1996,37039000,Photographic paper paperboard and textiles sensitised on exposed
1997,37040000,"Photographic plates, film, paper exposed but not developed"
1998,37051000,Photographic plate and film exposed and developed for offset reproduction
1999,37052000,Microfilms exposed and developed
2000,37059000,"Photographic plates and films, exposed and developed"
2001,37061000,"Cinematograph film of a width of 35mm or more exposed and developed, whether or not incorporating sound track or consisting only sound track."
2002,37069000,Cinematograph film
2003,37071000,Sensitising emulsions for photographic uses
2004,37079000,Chemical preparation for photographic uses
2005,38011000,Artificial graphite
2006,38012000,Colloidal or semi-colloidal graphite
2007,38013000,Carbonaceous pastes for electrodes and similar  pastes for furnace linings
2008,38019000,"Graphite or other carbon in  the form of pastes, blocks, plates or  other semi-manufactures"
2009,38021000,Activated carbon
2010,38029000,Activated natural mineral products
2011,38030000,Tall oil
2012,38040000,"Residual lyes from the manufacture of wood pulp, whether or not concentrated, desugared or chemically treated"
2013,38051000,"Gum, wood or sulphate turpentine oils"
2014,38052000,Pine oil
2015,38059000,"Crude tipentene, sulphite turpentine and other crude paracymene"
2016,38061000,Rosin and resin acid
2017,38062000,"Salts of rosin, of resin acids"
2018,38063000,Easters gums
2019,38069000,Gums
2020,38070000,"Wood tar, wood tar oil"
2021,38081010,Malathion formulation B.H.P.
2022,38081020,"Antimosquito coils, mat"
2023,38081090,Insecticides
2024,38082000,Fungicides
2025,38083000,"Herbicides, anti-sprouting products and plant growth regulators"
2026,38084000,Disinfectants
2027,38085000,Rodenticides
2028,38086900,"Insecticides, rodenticides, fungicides, herbicides, anti-sprouting products and plantgrowth regulators, disinfectants and similar products, put up in forms or packings for retail sale or as preparations or articles"
2029,38089000,Rodenticidies
2030,38089110,Anti-mosquito products
2031,38089190,Insecticides
2032,38089200,Fungicides
2033,38089300,"Herbicides, antisprouting products"
2034,38089310,"Herbicides, antisprouting products"
2035,38089390,Antisprouting Products & Plant Growth Regulator
2036,38089400,Disinfectants
2037,38089900,Anti-sprouting products and plant-growth regulators
2038,38091000,Finishing agents with a basis of amylaceous substance
2039,38099100,Finishing agents used in textile or like industries
2040,38099200,Finishing agent of a kind used in the paper or like industries
2041,38099300,Finishing agent of a kind used in the leather or like industries
2042,38099900,Finishing agent
2043,38101000,"Pickling preparation for metal surfaces: soldering, brazing or welding powders and pastes"
2044,38109000,Preparation of a kind used as cores or coating for welding electrodes or rod
2045,38111100,Anti knock preparations based on lead compound
2046,38111900,Anti-knock preparations
2047,38112100,Additives for lubricant oils containing petroleum oils or oils obtained from bituminous minerals
2048,38112900,Additive for lubricant oils
2049,38119000,"Oxidation inhibitors, gum inhibitors, viscosity improvers, anti-corrosive preparations and other prepared additives, for mineral oils (including gasoline) or for other liquids used for the same purposes as mineral oils"
2050,38121000,Prepared rubber accelerators
2051,38121090,Prepared rubber accelerators
2052,38121099,Prepared rubber accelerators
2053,38122000,Compound plasticisers for rubber or plastics
2054,38123000,Anti oxidising preparations and other compound stabilisers for rubber or plastics
2055,38123100,"Mixtures of oligomers of 2,2,4-trimethyl-1,2-dihydroquinoline (TMQ)"
2056,38123900,"Prepared rubber accelerators; compound plasticisers for rubber or plastics, not elsewhere specified or included;  antioxidising preparations and other compound stabilisers for rubber or plastics"
2057,38130000,Preparations and charges for fire-extinguishers
2058,38140000,"Organic composite solvents and thinners, prepared paint or varnish removers"
2059,38151100,Catalysts with nickel or nickel compounds as the active substance
2060,38151200,Supported catalysts with precious metal or precious metal compounds as the active substance
2061,38151900,Supported catalyst
2062,38159000,Reaction initiators
2063,38160000,"Refractory cements, mortors, concretes and similar compositions"
2064,38170000,Mixed alkylbenzenes and mixed alkylnaphthalenes
2065,38171000,Mixed alkylbenzenes
2066,38172000,Mixed alkylnaphthalenes
2067,38180000,Chemical elements doped for use in eleectronics
2068,38190000,Hydraulic brake fluids and other prepared liquids for hydraulic transmission
2069,38200000,"Anti-freezing preparations, prepared de-icing fluids"
2070,38210000,Prepared culture media for development of micro-organisms
2071,38220000,Diagnostic or laboratory reagents on a backing and prepared diagnostic or laboratory reagents whether or not on a backing
2072,38231100,Stearic acid
2073,38231200,Oleic acid
2074,38231300,Tall oil fatty acid
2075,38231900,Industrial monocarboxylic fatty acid
2076,38232000,Naphthenic acid
2077,38237000,Industrial fatty alcohols
2078,38241000,Prepared binder for foundary moulds or cores
2079,38242000,"Napathenic acids, their water-insoluble salts and their esters"
2080,38243000,Non-agglomerated metal carbides mixed together or with metallic binders
2081,38244000,"Prepared additive for cement, mortars or concretes"
2082,38245000,Non-refractory mortars and concretes
2083,38246000,Sorbitol
2084,38247100,Acyclic hydrocarbons perhalogenated only with fluorine and chlorine
2085,38247200,"Mixtures containing bromochlorodifluoromethane, bromotrifluoromethane or dibromotetrafluoroethanes"
2086,38247300,"Mixtures containing  halogenated derivatives of  methane, ethane or propane Containing hydrobromofluorocaborns"
2087,38247400,"Mixtures containing halogenated derivatives of methane,  ethane or propane Containing chlorofluorocarbons (CFCs), whethr or not  containing hydrochlorofluorocarbons ( HDFCs),  perfluorocarbons (PFCs) or hydrofluorocarbons (HFCs"
2088,38247500,Mixture containing carbon tetrachloride
2089,38247600,"Mixtures containing halogenated derivatives of  methane, ethane or propane, Containing 1,1,1-trichloroethane (methyl chloroform)"
2090,38247700,Mixtures containing perhalogenated derivatives of acyclic hydrocarbons containing two or more different halogens
2091,38247800,"Mixtures containing perfluorocarbons (PFCs) or hydrofluorocarbons (HFCs), but not containing chlorofluorocarbons (CFCs) or hydrochlorofluorocarbons (HCFCs)"
2092,38247900,Mixture containing prehalogenated derivatives or acyclic hydroharbon containing two or more different halogens
2093,38248100,Ethylene oxide
2094,38248200,"polychlorinated biphenyls (PCBs),  Polychlorinated terphenyls (PCTs) or polybrominated  biphenyls (PBBs"
2095,38248300,"Mixtures and preparations containing tris (2,3-dibromopropyl) phosphate"
2096,38248400,"Containing aldrin (ISO), camphechlor (ISO) (toxaphene), chlordane (ISO), chlordecone (ISO), DDT (ISO) (clofenotane (INN), 1,1,1- trichloro- 2,2-bis(p-chlorophenyl)ethane), dieldrin (ISO, INN), endosulfan (ISO), endrin (ISO), heptachlor (ISO) or mirex (ISO"
2097,38248500,"Containing 1,2,3,4,5,6-hexachlorocyclohexane (HCH (ISO)), including lindane (ISO, INN)"
2098,38248700,"Containing perfluorooctane sulphonic acid, its salts, perfluorooctane sulphonamides, or perfluorooctane sulphonyl fluoride"
2099,38249000,Residual products of the chemical or allied industries
2100,38249100,"Mixtures and preparations consisting mainly of (5-ethyl-2-methyl-2- oxido-1,3,2- dioxaphosphinan-5-yl)methyl methyl methylphosphonate and bis[(5-ethyl-2-methyl-2- oxido-1,3,2-dioxaphosphinan-5-yl)methyl] methylphosphonate"
2101,38249900,Prepared binders for foundry moulds or cores; chemical products and preparations of the chemical or allied industries
2102,38251000,Municipal waste
2103,38252000,Sewage sludge
2104,38253000,Clinical waste
2105,38254900,Waste organic solvents
2106,38255000,Waste of metal pickling liquors
2107,38256100,"Wastes from chemical or allied industries, mainly containing organic constituents"
2108,38256900,Wastes from chemical or allied industries
2109,38259000,Residual products of the chemical or allied industries
2110,38260000,"Biodiesel and mixtures thereof, not containing or containing less than 70 % by weight of petroleum oils or oils obtained from bituminous minerals"
2111,38271000,Mixed alkylbenzenes
2112,39011000,Polyethylene having a specificf gravity of less than 0.94
2113,39012000,Polythelene having a specific gravity of 0.94 or more
2114,39013000,Ethylene-vinyl acetate copolymers
2115,39014000,"Ethylene-alpha-olefin copolymers, having a specific gravity of less than 0.94"
2116,39019000,Polymers of ethylene in primary forms
2117,39021000,Polypropylene
2118,39022000,Polyisobutylene
2119,39023000,Propylene copolymers
2120,39029000,Polymers of propylene in primary forms
2121,39031000,Expansible
2122,39031100,Expansible polystyrene
2123,39031900,Polystyrene
2124,39032000,Styrene-acrylonitrile (SAN) copolymers
2125,39033000,Acrylonitrile-butadiene-styrene (ABS) copolymers
2126,39039000,Polymers of styrene in primary forms
2127,39041000,Polyvinyl chloride not mixed with any other substances
2128,39042100,PVC non-plasticised
2129,39042200,PVC plasticised
2130,39043000,Vinyl chloride-vinyl acetate copolymers
2131,39044000,Vinyl chloride copolymers
2132,39045000,Vinylidene chloride polymers
2133,39046100,Polytetrafluoroethylene
2134,39046900,Fluoro polymers
2135,39049000,"Polymers of vinyl chloride or of other halogenated olefins, in primary forms"
2136,39051200,Polyvinyl acetate in aqueous dispersion
2137,39051900,Polyvinyl acetate
2138,39052100,Vinyl acetate copolymers in aqueous dispersion
2139,39052900,Vinyl acetate copolymers
2140,39053000,Polyvinyl alcohol
2141,39059100,Copolymers
2142,39059900,Polymers of vinyl acetate
2143,39061000,Polymethyl methaarylate
2144,39069000,Acrylic polymers in primary form
2145,39071000,Polyacetals
2146,39072000,Polyethers
2147,39073000,Epoxide resins
2148,39074000,Polycarbonate
2149,39075000,Alkyd resins
2150,39076000,Polyethylene terephthalate
2151,39076100,Poly(ethylene terephthalate) Having a viscosity number of 78 ml/g or higher
2152,39076900,Poly(ethylene terephthalate
2153,39077000,Poly (lactic acid)
2154,39079100,Unsaturated polyesters
2155,39079900,Saturated polyesters
2156,39081000,"Polyamide -6, - 11, -12, -6, 6, -6, 9, -6,   10 or -6, 12"
2157,39089000,Polyamides in primary form
2158,39091000,Urea resins
2159,39092000,Melamine resins
2160,39093000,Amino-resins
2161,39093100,"Poly (methylene phenyl isocyanate) (crude MDI, polymeric MDI)"
2162,39093900,"Amino-resins, phenolic resins and polyurethanes"
2163,39094000,Phenolic resins
2164,39095000,Polyurethanes
2165,39100000,Silicones in primary form
2166,39111000,Petroleum resin
2167,39119000,"Polysulphides, polysulphones"
2168,39121100,Cellulose acetates not plasticised
2169,39121200,Cellulose acetates plasticised
2170,39122000,Cellulose nitrated (including collodions)
2171,39123100,Carboxymethylcellulose and its salts
2172,39123900,Cellulose ethers
2173,39129000,Cellulose and its chemical derivatives
2174,39131000,"Alginic acid, its salts and esters"
2175,39139000,Natural polymers
2176,39140000,Ion-exchanger based on polymers
2177,39151000,"Waste, scrap of polymers of ethylene"
2178,39152000,"Waste, scrap of polymers of styrene"
2179,39153000,"Waste, scrap of polymers of vinylchloride"
2180,39159000,"Waste, scrap of plastics"
2181,39161000,"Plastic, of polymer of ethylene"
2182,39162000,"Monofilament of which any cross-Sectional dimension exceeds 1 mm, rods, sticks and profile shapes, whether or not surface-worked but not otherwise worked of polymers of vinyl chloride"
2183,39169000,Monofilament plastic
2184,39171000,Artificial guts
2185,39172100,"Tubes, pipes and hoses of polymers of ethylene"
2186,39172200,"Tubes, pipes and hoses of polymers of propylene"
2187,39172300,"Tubes, pipes and hoses of polymers of vinyl chloride"
2188,39172900,"Tubes, pipes and hoses, rigid of plastic"
2189,39173100,"Flexible tubes, pipes and hoses"
2190,39173200,"Tubes, pipes and hoses, not reinforced or otherwise combined with other materials without fittings"
2191,39173300,"Tubes, pipes and hoses, not reinforced or otherwise combined with other materials with fittings"
2192,39173900,"Tubes, pipes and hoses of plastic"
2193,39174000,Plastic fittings
2194,39181000,Floor coverings of polymers of vinyl chloride
2195,39181010,"Roffing sheets, Roffing tiles of polymers of vinyl chloride"
2196,39181090,Floor coverings of polymers of vinyl chloride
2197,39189000,Floor covering of plastics
2198,39189010,"Roffing sheets, Roffing tiles"
2199,39189090,Floor coverings of plastics
2200,39191000,"Self-adhesive plates, sheets, film, foil, tape of plastic in rolls of a width not exceeding 20cm"
2201,39199000,"Self-adhesives plates, sheets, film, foil, tape, strip, and other flat shapes of plastic"
2202,39199090,"Self-adhersive plates, tape etc of plastic"
2203,39201000,"Plate,sheets, films, foil, and strip of polymers of ethelyne"
2204,39202000,"Plates,sheets, film, foil and strip of polymers of propylene"
2205,39203000,"Plate sheets, film, foil and strips of polymers of styrene"
2206,39204100,"Rigid non-cellular plates, sheeets of polymers of vinyl cloride"
2207,39204200,"Non-cellular plates, sheets of polymers of vinyl chloride, flexible"
2208,39204300,"Non-cellular plates, sheets of polymers of vinyl chloride, flexible, containing by weight not less than 6% of plasticisers"
2209,39204900,"Non-cellular plates, sheets of polymers of vinyl chloride, flexible"
2210,39205100,"Non-cellular plates, sheets of polymethyl methacrylate"
2211,39205900,"Non-cellular plates, sheets of acrylic polymers"
2212,39206100,"Plates, sheets, films, foils and strips of polycarbonates"
2213,39206200,"Plates, sheets, films, foils and strips of poly(ethelene terephthalate)"
2214,39206300,"plates, sheets, film, foil and strip, of plastics, non-cellular and not reinfor-ced,laminated, supported or similarly combined with other materials of unsaturated polyesters."
2215,39206900,"Plates, sheets, films, foils and strips of other polyesters"
2216,39207100,"plates, sheets, film, foil and strip regenerated cellulose"
2217,39207300,"Plates, sheets, film, foil and strip, of  plastics,  non-cellular and not reinforced, laminated, supported or similarly combined with other materials Of cellulose acetate"
2218,39207900,"Plates, sheets, films, foils and strips of cellulose derivatives"
2219,39209100,Polyvinyl butyral
2220,39209200,"Plates, sheets, film, foil and strip of polyamides"
2221,39209300,"Plates, sheets, film, foil and strip of amino-resins"
2222,39209400,Phenolic resins
2223,39209900,"Non-cellular plates, sheets, film, foil and strip of plastics"
2224,39209910,"Printed plates, sheets, film, foil and strip, of plastics, non-cellular and not reinforced, laminated, supported or similarly combined with other materials"
2225,39209990,"Plates, sheets, film, foil and strip, of plastics"
2226,39211100,Cellular of polymers of styrene
2227,39211200,"Cellular plate, sheet of polymer of vinyl chloride"
2228,39211300,"Plates, sheets, film, foils and strip of cellular polyurethanes"
2229,39211400,"Plates, sheets, film, foil and strip, of  plastics of regenerated cellulose"
2230,39211900,"Cellular plate, sheet of plastic"
2231,39219000,"Plate, sheet, film, foil and strip of plastic"
2232,39219010,"Printed, plates, sheets, film, foil and strip"
2233,39219090,"Plates, sheets, film, foil and strip of plastics"
2234,39221000,"Baths, shower-baths and wash-basins of plastic"
2235,39222000,Lavatory seats and covers of plastic
2236,39229000,"Flushing, cisterns and similar sanitary ware of plastic"
2237,39231000,"Boxes, cases, crates of plastic"
2238,39231010,Sacks and bags including cones
2239,39231090,"Boxes, cases, crates of plastic"
2240,39232100,Sacks and bags of polymers of ethylene
2241,39232900,Sacks and bags of plastic
2242,39233000,"Carboys bottles,flask and similar articles"
2243,39233010,Pet Bottle
2244,39233090,Sacks and bags (including cones)
2245,39234000,"Spools cops, bobbin and similar supports"
2246,39234010,Video and audio cassettes without mangnetic tape
2247,39234090,"Spools cops, bobbin and similar supports"
2248,39235000,"Stoppers, lids caps and other closures"
2249,39239000,"Article for the conveyance or packing of goods, of plastic"
2250,39241010,Infant feeding bottle
2251,39241020,Mealamine utensils
2252,39241090,"Tableware, kitchenware of plastic"
2253,39249000,Household and toilet articles of plastic
2254,39251000,"Reservoir, tanks, vats and similar container of a capacity exxceding 300L of plastics"
2255,39252000,"Doors, windows and frames of plastic"
2256,39253000,"Shutters, blinds and similar articles and parts thereof"
2257,39259000,Builders ware of plastic
2258,39261000,Office and school supplies of plastic
2259,39262000,Plastic apparel and gloves
2260,39263000,Plastic fittings for furniture
2261,39264000,Statuettes and ornamental articles of plastic
2262,39269010,"Bangles, Tika, beads of plastic"
2263,39269020,Plastic dyes for shoe making
2264,39269030,Laboratory equipment of plastic
2265,39269090,Articles of plastic
2266,39269091,Other articles of plastics nes
2267,39269099,Bird water feeder of plastics
2268,40011000,"Natural rubber latex, whether or not prevulcanised"
2269,40012100,Natural rubber in smoked sheets
2270,40012200,Technically specified natural rubber
2271,40012900,Natural rubber
2272,40013000,"Balata, gutta-percha, guayule, chicle and similar natural gums"
2273,40021100,Latex
2274,40021900,Styrene-butadiene rubber
2275,40022000,Butadiene rubber (synthetic)
2276,40023100,Isobutene-isoperne rubber
2277,40023900,Halo-isobutene-isoprene rubber (CIIR or BIIR)
2278,40024100,Latex
2279,40024900,Chloroprene rubber
2280,40025100,Acrylonitrile-butadiene rubber latex
2281,40025900,Acrylonitrile-butadiene rubber
2282,40026000,Isoprene rubber (IR)
2283,40027000,Ethylene-propylene-non-conjucated diene rubber
2284,40028000,"Mixtures of any product of Natural rubber, balata, gutta-percha, guayule chicle and  similar natural gums, in primary forms or in plates"
2285,40029100,Synthetic latex
2286,40029900,Synthetic rubber
2287,40030000,Reclaimed rubber in primary form
2288,40040000,Waste and scrap of rubber
2289,40051000,Rubber compounded wih carbon black or silica
2290,40052000,"Solution, disperision of compounded rubber"
2291,40059100,"Compounded rubber, unvulcanised in plates, sheets and strip"
2292,40059900,Compounded rubber
2293,40061000,Camel back strips for retreading rubber  tyres
2294,40069000,Articles of unvulcanised rubber
2295,40070000,Vulcanised rubber thread and cord
2296,40081100,"Plates, sheets and strip of cellular rubber"
2297,40081900,"Rods and profile shapes, of vulcanised rubber"
2298,40082100,"Plates, sheets and strip of non-cellular rubber"
2299,40082111,"Plates sheets, and strip"
2300,40082190,"Plates sheets, and strip"
2301,40082900,Non cellular rubber
2302,40091000,"Tubes, pipes and hoses of vulcanised rubber or than hard rubber not reinforced or otherwise combined with other materials, without fittings"
2303,40091100,"Tubes, pipes and hoses of vulcanised rubber or than hard rubber not reinforced or otherwise combined with other materials, without fittings"
2304,40091200,"Tubes, pipes and hoses, of vulcanised rubber other than hard rubber, with fittings"
2305,40092100,"Tubes, pipes and hoses of vulcanised rubber or than hard rubber reinforced or otherwise combined with other materials, without fittings"
2306,40092200,"Tubes, pipes and hoses reinforced or otherwise  combined only with metal with fittings"
2307,40093000,"Tubes, pipes and hoses, of vulcanised rubber, reinforced or othrwise combined only withtextile materials, without fittings"
2308,40093100,"Tubes, pipes and hoses, of vulcanised rubber, reinforced or othrwise combined only with textile materials, without fittings"
2309,40093200,"Tubes, pipes and hoses, of vulcanised rubber, reinforced or othrwise combined only with textile materials, with fittings"
2310,40094000,"Tubes, pipes and hoses of vulcanised rubber reinforced or otherwise combined with other materials without fittngs"
2311,40094100,"Tubes, pipes and hoses, of vulcanised rubber other than hard rubber, with or without their fittings (for example, joints, elbows, flanges Reinforced or otherwise combined with other materils Without fittings"
2312,40094200,"Tubes, pipes and hoses of vulcanised rubber reinforced or otherwise combined with other materials without fittngs"
2313,40095000,"Tubes, pipes, hoses with fitting"
2314,40101000,Trapezoidal cross
2315,40101100,"Conveyor belts or belting, of vulcanized rubber reinforced  only with metal"
2316,40101200,"Conveyer belt, reinforcrd only with textile materials"
2317,40101900,Conveyor belts and belting
2318,40102100,"Endless transmission belts of trapezoidal cross-section ( V-belts), whether or not grooved, of  a circumference exceeding 60cm but not exceeding 180cm"
2319,40102200,"Endless transmission belts of trapezodial cross-section, whether or not grooved, of a circumference exceeding 180 cm but not exceeding 240 cm"
2320,40102900,Conveyer or transmission belts or belting of vulcanised rubber
2321,40103100,Endless transmission belts of trapezoidal cross section (V-belts) V-ribbed of an outside circumference exceeding 60 cm but not exceeding 180 cm
2322,40103200,"Endless transmission belts of trapezoidal cross  Section (V-belts), other tnan V ribbed, of anoutside  circumference exceeding 60 cm but not exceeding 180 cm"
2323,40103300,"Endless transmission belts of  trapezoidal cross-Section (V-belts), V-ribbed, of an outside cicumference  exceeding 180 cm but not exceeding 240 cm"
2324,40103400,"Endless transmission belts of trapezoidal cross section (V-belts) , other than V-ribbed of an outside circumference exceeding 180 cm but not exceeding 240 cm"
2325,40103500,"Endless synchronous belts, of an outside circumference exceeding 60 cm but not exceeding 180 cm"
2326,40103600,"Endless synchronous belts, of an outside circumference exceeding150 cm but not exceeding 198 cm"
2327,40103900,Endless transmission belts
2328,40111000,New pneumatic rubber tyre for motorcar
2329,40112000,New pneumatic rubber tyre for buses or lorries
2330,40112900,Fireboard
2331,40113000,"New pneumatic rubber tyre, for aircraft"
2332,40114000,New pneumatic rubber tyre for motorcycles
2333,40115000,New pneumatic rubber tyre for bicycles
2334,40116100,"New pneumatic rubber tyre of a kind used on agricultural or forestry vehicles and machines , having a herring bone"
2335,40116200,"New pneumatic rubber tyre of a kind used on construction or industrial handing  vehicles and machines and having a rim size not exceeding 61 cm , having a herring bone"
2336,40116300,"New pneumatic rubber tyre of a kind used on construction or industrial handing  vehicles and machines and having a rim size exceeding 61 cm , having a herring bone"
2337,40116900,"New pneumatic rubber tyre, having a herring bone"
