S.N.,Product Code,Products
4203,73110000,"Container for compressed or liquefied gas, of iron or steel"
4204,73121000,"Stranded wire, ropes and cables"
4205,73129000,"Plaited bands,slings and the like"
4206,73130000,Barbed wire of iron or steel
4207,73141200,"Endless bands for machinery, of stainless steel"
4208,73141400,Woven cloth of stainless steel
4209,73141900,Woven cloth of iron or steel wire
4210,73142000,"Grill netting and fencing welded at the inter section, of wire with a maximum cross sectional dimension of 3 mm or more and having a mesh size of 100cm2 or more"
4211,73143100,"Grill, netting and fencing, welded at the inter section plated or coated with zinc"
4212,73143900,"Grill, netting and fencing welding at the intersection"
4213,73144100,"Cloth, grill, netting and fencing plated or coated with zinc"
4214,73144200,"Cloth, grill, netting and fencing plated or coated with plastics"
4215,73144900,Cloth grill netting and fencing of iron or steel
4216,73145000,Expanded Metal
4217,73151100,Roller chain
4218,73151200,Articulated link chain of iron or steel
4219,73151900,Parts of articulated link chain
4220,73152000,Skid chain
4221,73158100,Stud link
4222,73158200,Welded link
4223,73158900,Chain of iron or steel
4224,73159000,Parts of chain
4225,73160000,Anchors grapnels and parts therof of iron or steel
4226,73170000,"Nail , tacks,drawing pins, staples"
4227,73181100,Coach screws
4228,73181200,Wood screw
4229,73181300,Screw hooks and screw rings
4230,73181400,Self-tapping screws
4231,73181500,Screw and bolts of iron or steel
4232,73181600,Nuts
4233,73181900,Threaded articles of iron or steel
4234,73182100,Spring washers and other lock washers
4235,73182200,Non-threaded washers
4236,73182300,Rivets
4237,73182400,Cotters and cotter-pins
4238,73182900,Non threaded Articles
4239,73191000,"Sewing, darning or embroidery needles of iron or steel"
4240,73192000,Safety pins
4241,73193000,Pins
4242,73194000,Safety pins and other pins
4243,73199000,Articles of iron or steel for use in hand
4244,73201010,Leaf-springs and leaves therefor of Rickshaws
4245,73201090,Leaf-springs and leaves therefor
4246,73202000,Helical springs of iron or steel
4247,73209000,Springs and leaves of spring
4248,73211100,Cooking appliances and plate warmer for gas fuel or both gas other fuels
4249,73211190,Cooking appliances for gas fuel of iron or steel
4250,73211199,Cooking appliances for gas fuel of iron or steel
4251,73211200,Cooking appliances for liquid fuel
4252,73211300,Cooking appliances and plate warmers for solid fuel
4253,73211900,Cooking appliances and plate warmers including appliances for solid fuel
4254,73218100,Appliances for gas fuel or both gas and other fuels
4255,73218200,Non electric domestic appliances for liquid fuel
4256,73218300,Solid fuel appliances
4257,73218900,Appliances and plate warmers including appliances for solid fuel
4258,73219000,Parts of cooking appliances
4259,73221100,Radiators and parts of cast iron
4260,73221900,Radiators and parts
4261,73229000,Air heaters of iron or steel
4262,73231000,Iron or steel wool
4263,73239100,"Table, kitchen or other household articles and parts of cast iron, not enamelled"
4264,73239200,"Table, kitchen, households articles of cast iron"
4265,73239300,"Table, kitchen or household articles of stainless steel"
4266,73239400,"Table, kitchen or other household articles and parts of iron (other than cast iron) or steel, enamelled"
4267,73239900,"Table, kitchen or household article of iron or steel"
4268,73241000,Sink and wash basins of stainless steel
4269,73242100,"Baths of cast iron, whether or not enamelled"
4270,73242900,Baths of iron or steel
4271,73249000,"Sanitary ware and parts, of iron and steel"
4272,73251000,Cast articles of iron or steel of non-malleable cast iron
4273,73259100,Grinding balls and similar articles for mills
4274,73259900,Cast articles of iron or steel
4275,73261100,"Grinding balls and similar articles for mills, forged or stamped, but not further worked"
4276,73261900,Forged or stamped articles of iron or steel
4277,73262000,Articles of steel or iron wire
4278,73269000,Articles of steel or iron
4279,74010000,"Copper mattes, cement copper (precipitated copper)"
4280,74011000,Copper mattes
4281,74020000,Unrefined copper: copper anodes for elcetolytic refining
4282,74031100,Refined copper cathode and section of cathodes
4283,74031200,Wire-bars of copper
4284,74031300,Billets
4285,74031900,Refined copper
4286,74032100,Copper zinc base alloys (Brass)
4287,74032200,Copper tin base alloys
4288,74032900,Copper alloys
4289,74040000,Copper scrap
4290,74040010,Brass scrap
4291,74050000,Master alloy of copper
4292,74061000,Powders of non-lamellar structure of copper
4293,74062000,Copper powders of lamellar structure: flakes
4294,74071000,"Bars, rods of refined copper"
4295,74072100,"Copper bars, rods and profiles of copper-zinc base alloys ( brass)"
4296,74072900,"Bar, rods and profiles of copper alloys"
4297,74081100,Refined copper wire of which maximum cross-sectional dimension exceeds 6mm
4298,74081900,Refined copper wire
4299,74082100,Brass wire
4300,74082200,Copper wire of copper-nickel base alloys (cupro-nickel) or coppernickel-  zinc base alloys (nickel silver)
4301,74082900,Copper wire of copper alloys
4302,74091100,"Refined copper plates, sheets, strip in coil of a thickness exceeding 0.15mm"
4303,74091900,"Refined copper plates, sheets, strip of a thickness exceeding 0.15mm"
4304,74092100,"Refined brass plates, sheets, strip in coil of a thickness exceeding 0.15mm"
4305,74092900,"Copper plates, sheets and strip, of a thickness exceeding 0.15 mm of copper-zinc base alloys (brass)"
4306,74093100,"Copper plates, sheets and strip, of a thickness exceeding 0.15 mm in coils"
4307,74093900,"Copper plates, sheets, strip of a thickness exceeding 0.15mm of copper tin based alloys"
4308,74094000,Copper plate of copper nickel base alloys
4309,74099000,Copper tin base alloys
4310,74101100,Copper foil of refined copper( not backed)
4311,74101200,"Copper foil, not backed of copper alloys"
4312,74102100,"Copper foil (whether or not printed or backed with paper, paperboard, plastics or similar backing materials) of a thickness (excluding any backing) not exceeding 0.15 mm of refined copper not backed"
4313,74102200,Backed of refined copper
4314,74111000,Tubes and pipe of refined copper
4315,74112100,Tubes and pipes of copper-zinc base alloys
4316,74112200,Tubes and pipes of copper-nickel base alloys (cupro-nickel) or coppernickel-  zinc base alloys (nickel silver)
4317,74112900,Copper tubes and pipes
4318,74121000,Pipe fitings of refined copper
4319,74122000,Brass Fittings
4320,74130000,Stranded wire of copper
4321,74149000,"Grill and netting, of copper wire:  expanded metal of copper"
4322,74151000,"Nails and tacks, drawing pins, staple and similar articles of copper"
4323,74152100,Washers
4324,74152900,"Screw hooks, rivets, cotters, cotterpins of copper"
4325,74153300,Screws bolt and nuts
4326,74153900,"Threaded articles, of cpooer"
4327,74170000,"Cooking or heating apparatus of a kind used for domestic purposes, non-electric, and parts thereof, of copper"
4328,74181000,"Table, kitchen or other household articles and parts thereof; pot scourers and scouring or polishing pads, gloves and the like"
4329,74181100,"Pot scourers and scouring or polishing pads,   gloves and the like"
4330,74181900,"Table, kitchen or other household articles and parts thereof"
4331,74182000,Sanitaryware and parts of copper
4332,74191000,Chain and parts thereof
4333,74199100,"Cast, moulded, stamped or forged, but not further worked of copper"
4334,74199900,Articles of copper
4335,75011000,Nickel mattes
4336,75012000,Nickel oxide sinters and other intermediate products of nickel metallurgy
4337,75021000,"Nickel, not alloyed"
4338,75022000,Nickel alloys
4339,75030000,Nickel waste and scrap
4340,75040000,Nikel powders and flakes
4341,75051100,"Nickel bar, rods, profiles, Of nickel, not alloyed"
4342,75051200,"Tubes and pipes of nickel, not alloyed"
4343,75052100,"wire of nickel, not alloyed"
4344,75052200,"Wire of nickel, alloys"
4345,75061000,"Nickel plates, sheets, strip and foil, not alloy"
4346,75062000,"Nickel plates, sheets, strip and foil of nickel alloys"
4347,75071100,"Tubes and pipes of of nickel, not alloyed"
4348,75071200,"Tubes, pipes and tube or pipe fittings of nickel alloys"
4349,75072000,Tube or pipe fittings of Nickel
4350,75081000,"Cloth, grill and netting, of nickel wire"
4351,75089000,Articles of nickel
4352,76011000,"Aluminium, not alloyed"
4353,76012000,Aluminium alloys
4354,76020000,Aluminium scrap
4355,76031000,Aluminium powder of non-lamellar structure
4356,76032000,Powders of lamellar structure: flakes
4357,76041000,"Bars, rods and profiles of aluminium not alloyed"
4358,76041010,Aluminium Profiles
4359,76041090,"Aluminium bars, rods"
4360,76042100,Hollow profiles of aluminium alloys
4361,76042900,Bars rods and profiles of aluminium alloy
4362,76051100,Alminium wire of which the maximum cross-sectional dimension excceds 7 mm
4363,76051900,"Wire of aluminium, not alloyed"
4364,76052100,Alluminium alloys of which the maximum cross-sectional dimension exceeds 7 mm
4365,76052900,Wire of aluminium alloys
4366,76061100,"Rectangular plates of aluminium, not alloyed"
4367,76061200,"Rectangular plates of aluminium, alloyed"
4368,76069100,"Aluminium plates, sheets and strip not alloyed"
4369,76069200,"Plate, sheets and strips of a thickness exceeding 0.2mm of aluminium alloys"
4370,76071100,"Aluminium foil not backed,rolled but not further worked"
4371,76071900,Aluminum foil not backed
4372,76072000,"Aluminium foil, backed"
4373,76081000,"Aluminium tubes and pipes, not alloyed"
4374,76082000,Tubes and pipes of aluminium alloys
4375,76090000,Aluminium tube or pipe fittings
4376,76101000,"Aluminium doors, windows and their frames"
4377,76109000,Aluminium structures
4378,76110000,"Aluminium reservoirs, tanks, vats and similar containers, for any material (other than compressed or liquefied gas), of a capacity exceeding 300 l, whether or not 	lined or heat-insulated, but not fitted with mechanical or thermal equipment"
4379,76121000,Collapsible tubular container
4380,76129000,"Aluminium cask, drums, cans, boxes and similar container"
4381,76130000,Aluminium containers for compressed or liquified gas
4382,76141000,Stranded wire of aluminium with steel core
4383,76149000,Stranded wire of aluminium
4384,76151000,"Table, kitchen or other household articles and parts thereof; pot scourers and scouring or polishing pads, gloves and the like"
4385,76151100,"Pot scourers and scouring or polishing pads, gloves and the like"
4386,76151900,"Table, kitchen or other household articles and parts thereof"
4387,76152000,Sanitary ware and parts of aluminium
4388,76161000,"Aluminium nails,tacks,Staples,screw bolts"
4389,76169100,"Cloth, grill, netting and fencing, of aluminium wire"
4390,76169900,Articles of aluminium
4391,78011000,"Refined lead, unwrought"
4392,78019100,Unwrought lead containing by weight antimony as the principal other element
4393,78019900,Unwrought lead
4394,78020000,Lead scrap
4395,78030000,"Lead bars, rods, profiles and wire"
4396,78041100,"Sheets, strip and foil of a thickness (excluding any backing) not exceeding 0.2 mm of leads"
4397,78041900,"Lead plates, sheets, strip and foil; lead powders and flakes"
4398,78042000,Lead powdered and flakes
4399,78050000,"Lead tubes, pipes and tube or pipe fittings"
4400,78060000,Lead articles
4401,79011100,"Unwrought zinc, not alloyed containing by weight 99.99% or more of zinc"
4402,79011200,Zinc not alloy containing by weight not less than 99.9%
4403,79012000,Zinc alloys
4404,79020000,Zinc scrap
4405,79031000,Zinc dust
4406,79039000,Zinc powders
4407,79040000,"Zinc bars,rods,profiles and wire"
4408,79050000,"Zinc plates, sheets, strip, foil"
4409,79060000,"Zinc tubes, pipes"
4410,79070000,Articles of zinc
4411,80011000,"Tin, not alloyed"
4412,80012000,Tin alloys
4413,80020000,Tin scrap
4414,80030000,"Tin bars, rods, profiles and wires"
4415,80040000,Tin plate
4416,80060000,"Tin tubes, pipes and tube or pipe fittings (for example, couplings, elbows, sleeves"
4417,80070000,Articles of tin
4418,81011000,Powered tungsten
4419,81019400,"Unwrought tungsten, including bars and rods obtained simply by sintering"
4420,81019600,"Wire of nickel, not alloyed"
4421,81019900,Tungsten and atiicles thereof
4422,81029500,"Bars and rods, other than those obtained simply by  sintering, profiles, plates, sheets, strip and foil"
4423,81029900,"Molybdenum and articles thereof, including waste and  scrap"
4424,81039000,Tantalum and articles thereof
4425,81041100,Unwrought magnesium containing at least 99.8% by weight of magnesium
4426,81041900,"Magnesium and articles thereof, including waste and  scrap"
4427,81043000,"Raspings, turnings and granules, graded  according to size; powders"
4428,81049000,"Magnesium and articles thereof, including waste and scrap"
4429,81052000,Cobalt mattes and other intermediate products of cobalt metallurgy; unwrought cobalt; powders
4430,81053000,Waste and scrap of Cobalt
4431,81059000,Cobalt mattes
4432,81060000,"Bismuth and articles thereof, including waste and scrap"
4433,81072000,Unwrought cadmium; powders
4434,81073000,Waste and scrap of cadmium
4435,81079000,Cadmium and articles
4436,81082000,"Titanium and articles thereof, including waste and scrap Unwrought titanium; powders"
4437,81089000,Wire of Tungsten (wolfram)
4438,81099000,Zirconium and articles thereof
4439,81099900,"Tungsten (wolfram) and articles  thereof, including waste and scrap"
4440,81100000,"Antimony and articles thereof, including waste and scrap"
4441,81101000,Unwrought antimony: powders
4442,81109000,Antimony and articles thereof
4443,81110000,"Manganese and articles thereof, including waste and scrap"
4444,81121900,Beryllium
4445,81125900,Thallium
4446,81129900,"Vanadium, gallium, hafnium, indium, niobium (columbium), rhenium and and articles of these metals, including waste and scrap."
4447,81130000,"Cermets and articles thereof, including waste and scrap"
4448,82011000,Spades and shovels
4449,82011010,Spades
4450,82011090,Shovels
4451,82012000,Forks
4452,82013000,"Mattocks, picks, hoes and rakes"
4453,82014000,"Axes, bill hooks and similar hewing tools"
4454,82015000,Secateurs and similar one handed pruners and shears  (Including poultry shears)
4455,82016000,"Hedge shears, two-handed pruning shears and similar two-handed shears"
4456,82019000,"Hand tools, used in agriculture, horticulture or forestry"
4457,82019010,Hand tools of a kind used in agriculture or horticulture
4458,82019090,Hand tools of a kind used in forestry
4459,82021000,Hand saws
4460,82022000,Band saw blades
4461,82023100,Circular saw blades with working part of steel
4462,82023900,Circular saw blades including parts
4463,82024000,Chain saw blades
4464,82029100,"Straight saw blades, for working metals"
4465,82029900,Saw blades
4466,82031000,"Files, raps and similar tools"
4467,82032000,Pilers(including cutting pilers)
4468,82033000,Metal cutting shears and similar tools
4469,82034000,"Pipe cutters, bolt cutters, perforating punches and similar tools"
4470,82041100,Non adjustable hand operated spanners and wrenches
4471,82041200,Adjustable hand-operated spanners and wrenches
4472,82042000,Interchangeable spanner sockets
4473,82051000,"Drilling, threading or tapping tools"
4474,82052000,Hammers and sledge hammers
4475,82053000,"Planes, chisels, gouges and similar cutting tools for working woods"
4476,82054000,Screw drivers
4477,82055100,Household tools
4478,82055900,Hand tools (including glaziers diamonds)
4479,82056000,Blow lamps
4480,82057000,"Vices, clamps and the like"
4481,82058000,anvils: portable forges: hand or pedal-operated grinding wheels with frameworks
4482,82059000,Sets of articles of two or more of hand tools
4483,82060000,Hand tools in set
4484,82071300,Rock drilling or earth boring tools with working part of cermets
4485,82071900,"Rock drilling or earth boring tools, including parts"
4486,82072000,Dies for drawing or extruding metal
4487,82073000,"Tools for pressing, stamping or punching"
4488,82074000,Tools for tapping or threading
4489,82075000,Tolls for drilling other than for rock drilling
4490,82076000,Tools for boring or broaching
4491,82077000,Tools for milling
4492,82078000,Tools for turning
4493,82079000,Interchangeable tools
4494,82081000,Knives or cutting blades for metal working
4495,82082000,Knives for wood workings
4496,82083000,Knives for kitchen appliances
4497,82084000,"Knives and cutting blades for agricultural, horticultural or forestry machines"
4498,82089000,Marbel cutting blades
4499,82090000,"Plates, sticks, tips and the like for tools,unmounted, of cermets"
4500,82100000,"Hand operated mechanical appliances, weighing 10kg or less, used in preparation of food or drink"
4501,82111000,Sets of assorted articles
4502,82119100,Table knives having fixed blades
4503,82119200,Knives having fixed blades
4504,82119300,Knives having  other than fixed blades
4505,82119400,Blades
4506,82119500,Handles of base metal
4507,82121000,Razors
4508,82122000,Safety razor blades
4509,82129000,Razors and razor blades parts
4510,82130000,Scissors
4511,82141000,"Paper knives, pencil sharpners"
4512,82142000,Manicure or pedicure sets and instruments(including nail files)
4513,82149000,"Hair clippers, butchers or kitchen cleavers, choppers and mincing knives"
4514,82151000,Set of assorted articles containing at least one article with precious metal
4515,82152000,Set of assorted articles
4516,82159100,"Spoons, forks, ladles, skimmers, cake-servers, fish-knives, butter-knives, sugar tongs and similar kitchen or tableware plated with precious metal"
4517,82159900,"Spoon, forks"
4518,83011000,Padlocks
4519,83012000,Motor vehicle locks
4520,83013000,Furniture locks
4521,83014000,Locks
4522,83015000,"Clasp and frames with clasp,in corporating locks"
4523,83016000,Parts of padlocks and locks
4524,83017000,Keys presented seperately
4525,83021000,Hinges
4526,83022000,Castors
4527,83023000,"Mountings, fittings and similar articles suitable for  motor  vehicles"
4528,83024100,"Mounting,fitting or similar article suitable for building"
4529,83024200,"Mountings, fittings and similar articles suitable for furniture"
4530,83024900,Mounting fitting and similar articles
4531,83025000,"Hat-racks,hat-pegs and similar articles"
4532,83026000,Automatic door closers
4533,83030000,"Armoured or reinforced safes, strong boxes and doors and safe deposit lockers for strong rooms"
4534,83040000,Filing cabinet. card index cabinet and similar office equipment of base metal
4535,83051000,"Fittings for loose, leef binders or files"
4536,83052000,Staples in strip
4537,83059000,"Letter clips, letter corners, paper clips, indexing tags and similar office articles"
4538,83061010,Bicycle bells
4539,83061090,Bicycle gongs and the like
4540,83062100,Statuettes and other ornaments plated with precieous metal
4541,83062900,Statuettes of base metal
4542,83063000,"Photograph, picture or similar frames, mirrors of base metal"
4543,83071000,Flexible tubing of base metal with or without fitting of iron or steel
4544,83079000,Flexible tubing of base metal with or without fitting ofbase metal
4545,83081000,"Hooks, eyes, and eyelets of base metal, used for clothing, footwear"
4546,83082000,Tubular or bifurcated rivetes of base metal
4547,83089000,"Clasps, frames with clasps, buckles, buckle-clasps including parts"
4548,83091000,Crown corks of base metal
4549,83099010,P .P .Cap (Raw materials for stationary Industries)
4550,83099090,"Stopper, caps and lids"
4551,83100000,"Sign plate,name plate"
4552,83111000,"Coated electrodes of base metal, for electric arc-welding"
4553,83112000,"Cored wire of base metal, for electric arc wielding"
4554,83113000,"Coated rods and cored wire,of base metal, for soldireing"
4555,83119000,"Wire rods, tubes, plates including parts"
4556,84011000,Nuclear reactor
4557,84012000,Machinery and apparatus for isotopic separation and parts thereof
4558,84013000,"Fuel elements (cartridges), non-irradiated"
4559,84014000,Parts of nuclear reactors
4560,84021100,Watertube boilers with a steam croduction exceeding 45 t per hour
4561,84021200,Watertube boilers with steam production exceeding 45t  per hour
4562,84021900,"Vapour generating boilers, including hybrid boiler"
4563,84022000,Super-heated water boilers
4564,84029000,Parts of steam or other vapour generating boiler
4565,84031000,Central heating Boilers
4566,84039000,Parts of boilers
4567,84041000,Auxillary plant for use with boilers
4568,84042000,Condensers for steam or other vapour power units
4569,84049000,Parts of auxillary plant for use with boilers
4570,84051000,Producer gas or water gas generators
4571,84059000,Parts of gas producer or water gas generator
4572,84061000,Turbine for marine propulsion
4573,84061900,Flat surface grinding machine
4574,84068100,Steam turbines and other vapour turbines of an output exceeding 40  MW
4575,84068200,Steam turbine of an output exceeding 40MW
4576,84069000,Parts of steam turbines
4577,84071000,Aircraft engines
4578,84072100,Outboard motors
4579,84072900,Marine propulision engines
4580,84073100,Eciprocating piston engines of a kind used for the propulsion of vehicles of a cylinder capacity not exceeding 50 cc
4581,84073200,Reciprocating piston engine of a kind used for the propulsion of vehicle of a cylinder capacity exceeding 50 cc but not exceeding 250 cc
4582,84073300,Reciprocating piston engine of a kind used for the propulsion of vehicle of a cylinder capacity exceeding 250 cc but not exceeding 1000 cc
4583,84073400,"Reciprocating piston engines of a kind used for the  propulsion of vehicles of a cylinder capacity exceeding 1,000 cc"
4584,84079000,Spark-ignition reciprocating or rotary internal combustion piston engines
4585,84081000,Marine propulsion engine
4586,84082000,Engines of a kind used for propulsion of vehicles
4587,84089000,Compression-ignition internal combustion piston engines
4588,84091000,Parts of aircrafts engine
4589,84099100,Parts suitable for spark ignition internal combustion piston engine
4590,84099110,Parts for spark-ignition internal combustion engines (excl aircraft)
4591,84099190,Parts for spark-ignition internal combustion engines
4592,84099900,Parts suitable for use solely or principally with compression ignition internal combustion piston engines
4593,84099910,Parts for compression-ignition internal combustion engines
4594,84099990,Parts for compression-ignition internal combustion engines
4595,84101100,"Hydraulic turbines and water wheels, of a power not exceeding 1000 kW"
4596,84101200,"Hydraulic turbines and water wheels, of a power exceeding 10000 kW but not cxeeding 10,000 kW"
4597,84101300,"Hydraulic turbines and water wheels, of a power exceeding 10000 kW"
4598,84109000,"Parts of hydraulic turbine, including regulators"
4599,84111100,Turbo-jets of a thrust not exceeding 25 kN
4600,84111200,Turbo-jets of a thrust exceeding 25 kN
4601,84112100,"Turbo-propellers of a power not exceeding 1,100 kW"
4602,84112200,"Turbo-propellers of a power exceeding 1,100 kW"
4603,84118100,"Gas turbine of a power not excedding 5,000 kW"
4604,84118200,"Gas turbine of a power  excedding 5,000 kW"
4605,84119100,Parts of turbo-jets or turbo-propellers
4606,84119900,Parts of gas turbines
4607,84121000,Reaction engine other than turbo-jets
4608,84122100,"Linear acting (cylinders), hydraulic power engines and motors"
4609,84122900,Hydrulic power engine
4610,84123100,"Linear acting (cylinders), pneumatic power engines and motors"
4611,84123900,Pnuematic power engines and motors
4612,84128000,Engine and motors
4613,84129000,Parts of engine and motors
4614,84131000,Pump desinging fuel or lubricant
4615,84131100,"Pumps for dispensing fuel or lubricants, fitted with measuring device"
4616,84131900,Pump fitted or desinged to be fitted with a measuring device
4617,84132000,Hand pumps
4618,84133000,"Fuel, lubricating or cooling medium pumps for internal combution piston engines"
4619,84134000,Concrete pump
4620,84135000,Reciprocating positive displacement pumps
4621,84136000,Rotary positive displacement pump
4622,84137000,Centrifugal pumps
4623,84137010,Centrifugal pumps of a capacity of 2 to 8 Horse Power
4624,84137011,"Centrifugal pumps to be run on gasoline, of a capacity of 2 to 8 Horse Power"
4625,84137019,Centrifugal pumps to be run on gasoline
4626,84137090,"Pumps for liquids, whether or not fitted with a measuring device;liquid elevators"
4627,84138100,Pump for liquids not fitted with measuring device
4628,84138200,Liquid elevators
4629,84139100,Parts of pump
4630,84139200,Parts of liquid elevator
4631,84141000,Vacuum pump
4632,84142000,Hand or foot operated air pumps
4633,84143000,Compressors of a kind used in refrigerating equipment
4634,84144000,Air compressors mounted on a wheeled chasis for towing
4635,84145100,Fans with self contained electric motor of an output not exceeding 125w
4636,84145900,Fans with self contained electric motor of an output exceeding 125 w
4637,84146000,Hoods having a maximum horizontal side not exceeding 120cm
4638,84148000,Ventelering or recycling hoods
4639,84149000,Parts of air or vacuum pumps
4640,84151000,"Air conditioner, window or wall types"
4641,84152000,"Air conditioner, of a kind used for persons in motor vehicles"
4642,84158100,Air conditioning machine incorporating refrigerator unit and a valve for reversal of the cooling/heat cycle
4643,84158200,"Air conditioning machine, incorporating a refrigerating unit"
4644,84158300,Air conditioning machine not incorporating or refregerating unit
4645,84159000,Air condition parts
4646,84161000,Furnace burners for liquid fuel
4647,84162000,"furnace burner, including combination burners"
4648,84163000,"Mechanical strokers, mechanical graters,"
4649,84169000,Parts of furnace burners for liquid fuel
4650,84171000,Furnaces and ovens for the roasting
